<?xml version="1.0" encoding="UTF-8" ?>
<xs:schema xmlns:xs="http://www.w3.org/2001/XMLSchema">
    <xs:element name="messages">
        <xs:complexType>
            <xs:sequence>
                <xs:element name="message" maxOccurs="unbounded">
                    <xs:complexType>
                        <xs:attribute name="id" type="xs:string" use="required"/>
                        <xs:attribute name="value" type="xs:string" use="required"/>
                    </xs:complexType>
                </xs:element>
            </xs:sequence>
        </xs:complexType>
    </xs:element>
</xs:schema>
